{
  "name": "email-system-integration",
  "description": "Complete email system integration with IMAP and SMTP support for the ERP application",
  "version": "1.0.0",
  "status": "completed",
  "category": "backend",
  "tags": ["email", "imap", "smtp", "communication"],
  "changes": [
    {
      "component": "server.js",
      "description": "Added IMAP and SMTP routes and handlers",
      "impact": "Full email sending and receiving capabilities"
    },
    {
      "component": "public/index.html",
      "description": "Implemented email UI with compose, inbox, and settings panels",
      "impact": "Complete email management interface"
    },
    {
      "component": "Environment Configuration",
      "description": "Added IMAP and SMTP configuration options",
      "impact": "Flexible email server configuration"
    }
  ],
  "dependencies": [],
  "created": "2026-01-19",
  "updated": "2026-01-19",
  "author": "Development Team"
}
