{
  "name": "vibe-coding-methodology",
  "description": "Implementation of Nicolas Zullo's Ultimate Guide to Vibe Coding v1.2 - planning-first workflow with memory-bank system",
  "version": "1.2.0",
  "status": "completed",
  "category": "other",
  "tags": ["methodology", "workflow", "planning", "memory-bank", "incremental-development"],
  "changes": [
    {
      "component": "memory-bank/",
      "description": "Established memory-bank system with PRD.md, tech-stack.md, implementation-plan.md, architecture.md, progress.md",
      "impact": "Long-term AI memory system prevents workflow amnesia and ensures consistent development approach"
    },
    {
      "component": "Workspace Rules",
      "description": "Implemented planning-first workflow requiring memory-bank review before any code changes",
      "impact": "Forces structured approach: read memory-bank → clarify requirements → implement one step at a time → verify → update docs"
    },
    {
      "component": "Implementation Process",
      "description": "Enforced step-by-step verification with user confirmation before proceeding to next step",
      "impact": "Prevents scope creep and ensures each step is fully tested before moving forward"
    },
    {
      "component": "Code Quality Rules",
      "description": "Established modular architecture with prohibition of giant files and mandatory file size limits",
      "impact": "Maintains codebase maintainability and prevents monolithic file growth"
    },
    {
      "component": "Progress Tracking",
      "description": "Required updates to progress.md and architecture.md after completing each major feature/milestone",
      "impact": "Creates comprehensive development history and decision documentation"
    }
  ],
  "dependencies": [],
  "created": "2026-01-20",
  "updated": "2026-01-20",
  "author": "Development Team"
}
