{
  "name": "quotation-tag-selection",
  "description": "Implements interactive tag selection for quotation creation with highlighting, hover effects, and dynamic sub-board display",
  "version": "1.0.0",
  "status": "completed",
  "category": "frontend",
  "tags": ["ui", "quotation", "interaction", "selection"],
  "changes": [
    {
      "component": "Quotation Panel",
      "description": "Modified quotation panel HTML structure to include sub-board area and tag buttons with data attributes",
      "impact": "Added interactive quotation type selection with dynamic content loading"
    },
    {
      "component": "CSS Styles",
      "description": "Added .quotation-tag-btn.selected and .quotation-tag-btn:hover:not(.selected) styles",
      "impact": "Implemented visual feedback for tag selection (black/white) and hover states (grey/black)"
    },
    {
      "component": "JavaScript Functions",
      "description": "Added initializeQuotationPanel(), showQuotationSubBoard(), generateQuotationContent(), and getProductSpecificFields() functions",
      "impact": "Created complete tag selection logic with dynamic form generation for different quotation types"
    },
    {
      "component": "Tag Selection Logic",
      "description": "Implemented single-selection mechanism where only one tag can be selected at a time",
      "impact": "Users can select quotation type and see corresponding form with product-specific fields"
    },
    {
      "component": "Dynamic Forms",
      "description": "Created different form fields for Hang Tag, Woven Label, Care Label, Heat Transfer, and Others",
      "impact": "Each quotation type shows relevant input fields for accurate quoting"
    }
  ],
  "dependencies": [],
  "created": "2026-01-19",
  "updated": "2026-01-19",
  "author": "Development Team"
}
