{
  "name": "path-normalization",
  "description": "Normalizes file paths to use forward slashes for cross-platform URL compatibility",
  "version": "1.0.0",
  "status": "completed",
  "category": "backend",
  "tags": ["path", "cross-platform", "url", "normalization", "windows"],
  "changes": [
    {
      "component": "Path Utility Function",
      "description": "Created normalizePath utility function to convert backslashes to forward slashes",
      "impact": "Ensures consistent URL formatting across Windows and Unix systems"
    },
    {
      "component": "server.js - Profile Image Upload",
      "description": "Applied path normalization when storing profile image paths in database",
      "impact": "Profile image URLs now use correct forward slashes instead of backslashes"
    },
    {
      "component": "server.js - Attachment Upload",
      "description": "Applied path normalization when storing attachment paths in database",
      "impact": "Attachment URLs now use correct forward slashes instead of backslashes"
    },
    {
      "component": "Database Migration",
      "description": "Updated existing database records to replace backslashes with forward slashes in profile image and attachment paths",
      "impact": "All existing file paths now use correct forward slashes for URL compatibility"
    },
    {
      "component": "public/index.html",
      "description": "Reverted client-side path normalization fixes since paths are now normalized server-side",
      "impact": "Cleaner code and single source of truth for path normalization"
    }
  ],
  "dependencies": [],
  "created": "2026-01-20",
  "updated": "2026-01-20",
  "author": "Development Team"
}
