{
  "name": "quotation-view-system",
  "description": "Implements quotation view system with table display and filtering capabilities",
  "version": "1.0.0",
  "status": "completed",
  "category": "frontend",
  "tags": ["quotation", "view", "table", "filter", "localStorage"],
  "changes": [
    {
      "component": "Quotation View Panel",
      "description": "Created quotationViewPanel with table structure and filter inputs in headers",
      "impact": "Users can view all quotations in a structured table format with real-time filtering"
    },
    {
      "component": "localStorage Integration",
      "description": "Implemented localStorage-based quotation persistence system with JSON storage, unique IDs, and timestamps",
      "impact": "Quotations persist across browser sessions without requiring backend database"
    },
    {
      "component": "JavaScript Functions",
      "description": "Added initializeQuotationViewPanel(), displayQuotations(), applyQuotationFilters(), viewQuotationDetails(), saveQuotationToStorage(), and loadQuotationsFromStorage()",
      "impact": "Complete quotation management functionality with CRUD operations"
    },
    {
      "component": "Advanced Filtering System",
      "description": "Implemented real-time filtering with text filters (customer, contact, email, phone), dropdown filter (product type), numeric filters (quantity, total), and date filter (creation date)",
      "impact": "Users can quickly find specific quotations using multiple filter criteria"
    },
    {
      "component": "Detail Modal",
      "description": "Created click-to-view modal displaying customer information, product details, pricing information, notes, and creation date",
      "impact": "Users can view complete quotation details without leaving the table view"
    },
    {
      "component": "Table Columns",
      "description": "Structured table with columns: Customer Name, Contact Person, Email, Phone, Product Type, Quantity, Total (HKD), Date Created",
      "impact": "Clear presentation of key quotation information for quick scanning"
    }
  ],
  "dependencies": [],
  "created": "2026-01-19",
  "updated": "2026-01-19",
  "author": "Development Team"
}

