{
  "name": "clean-border-applied",
  "description": "Documents the application of clean border styling with white backgrounds and black borders throughout the application",
  "version": "1.0.0",
  "status": "completed",
  "category": "design",
  "tags": ["ui", "styling", "borders", "frontend"],
  "changes": [
    {
      "component": "Card Component",
      "description": "Changed from bg-card rounded-xl border to bg-white rounded-none border border-black",
      "impact": "Applied white background and black borders with no rounded corners"
    },
    {
      "component": "Button Component",
      "description": "Updated base variant from rounded-md to rounded-none, updated size variants (sm, lg) from rounded-md to rounded-none",
      "impact": "All buttons now have sharp corners instead of rounded ones"
    },
    {
      "component": "Input Component",
      "description": "Changed from rounded-md to rounded-none",
      "impact": "Input fields now have sharp corners"
    },
    {
      "component": "Dialog Component",
      "description": "Updated DialogContent from rounded-lg to rounded-none",
      "impact": "Dialog modals now have sharp corners"
    }
  ],
  "dependencies": [],
  "created": "2026-01-19",
  "updated": "2026-01-19",
  "author": "Development Team"
}
